id,text,used
1,恋愛関係において最も大切なのは、相手があなたをどれだけ特別な存在として扱ってくれるかです。高級レストランに連れて行ってくれることよりも、疲れた日に「大丈夫？」と気遣ってくれることのほうがずっと愛の証明になります。本当の愛は日常の中にこそあるのです。そして、そんな愛を与えてくれる人こそ、あなたが選ぶべき相手なのです。,False
2,女性が本当に求めているのは完璧な男性ではありません。自分の不完全さを認めて、一緒に成長しようとしてくれる男性です。間違いを認めて謝れる男性、話し合いから逃げない男性、あなたの気持ちを理解しようと努力する男性。そういう男性との関係は、時間とともに深まっていきます。完璧を装う男性より、誠実に向き合ってくれる男性を選んでください。,False
3,恋愛で苦しんでいる女性の多くは、相手を変えようとして疲れ果てています。でも本当は、変わる気のない相手を変えることはできません。あなたができるのは、自分の基準を明確にして、その基準を満たす相手を選ぶことだけです。愛のない男を愛のある男に変えようとするより、最初から愛のある男を見つけることに時間を使ってください。,False
4,付き合っているのに不安になるような関係は、本当の意味で付き合っているとは言えません。本当に愛し合っている二人なら、お互いに安心感を与え合うものです。連絡が遅くても疑わない、会えない日があっても信頼している、そんな関係こそが健全な恋愛です。不安ばかり感じる関係なら、それは愛ではなく執着かもしれません。,False
5,男性の本気度は言葉ではなく行動に現れます。「愛してる」と言いながら約束を守らない男より、言葉は少なくてもあなたのために時間を作ってくれる男のほうが信頼できます。会いたいと思ったら会いに来る、大切な日を覚えている、あなたの話を真剣に聞く。そういう行動こそが、本物の愛の証明なのです。,False
6,自己肯定感の高い女性は、相手に合わせて自分を変えようとしません。ありのままの自分を受け入れてくれる相手を待つ余裕があります。無理に笑顔を作らない、嫌なことには嫌と言える、自分の価値観を大切にする。そんな女性は結果的に、本当に相性の良い素敵な男性と出会えるのです。自分を偽らないことが、幸せな恋愛への近道です。,False
7,別れた後に「やっぱりあなたが必要だ」と言ってくる男には注意してください。本当にあなたが必要なら、別れる前にそう気づいているはずです。失ってから気づくのは愛ではなく、ただの所有欲です。一度手放した相手が戻ってきても、同じことを繰り返すだけです。前に進む勇気を持って、新しい幸せを探してください。,False
8,恋愛において一番避けるべきは、自分の直感を無視することです。「何か違う」と感じたら、その感覚を大切にしてください。理由が説明できなくても、あなたの心は正しいサインを送っています。違和感を感じながら関係を続けても、結局は時間の無駄になります。自分の感覚を信じて、勇気を持って決断することが大切です。,False
9,本当に愛してくれる男性は、あなたを他の女性と比較しません。元カノの話を持ち出さない、「普通の女性なら」と言わない、あなたの個性を認めてくれる。そんな男性こそが、あなたを心から大切に思っている証拠です。比較されて傷つくような関係より、あなたらしさを愛してくれる関係を選んでください。,False
10,幸せな結婚生活を送っている女性たちには共通点があります。それは相手に期待しすぎないことです。パートナーは自分を幸せにしてくれる存在ではなく、一緒に幸せを作っていく存在だと理解しています。お互いが自立していて、支え合える関係。それこそが、長続きする幸せな関係の秘訣なのです。,False
11,恋愛で一番もったいないのは、自分の価値を低く見積もることです。「私なんかじゃ釣り合わない」と思っていると、本当にあなたにふさわしい相手を見逃してしまいます。あなたには素晴らしい魅力があり、それに気づいてくれる人が必ずいます。自分の価値を信じて、堂々と恋愛を楽しんでください。そうすれば、本当にふさわしい相手と出会えるのです。,False
12,男性が本気で愛している女性には、必ず時間を作ります。どんなに忙しくても、5分の電話はできるし、おやすみのメッセージも送れます。「忙しいから」という言い訳ばかりする男性は、あなたを優先順位の上位に置いていません。本当に大切な相手なら、どんな状況でも繋がりを保とうとするものです。言い訳ではなく、行動を見てください。,False
13,いい女とは、自分の機嫌を自分で取れる女性のことです。彼からの連絡がなくても自分の時間を楽しめる、デートがキャンセルになっても別の楽しみを見つけられる、一人でも充実した生活を送れる。そんな女性は男性から見ても魅力的です。相手に依存しない自立した女性こそ、本当の意味でのいい女なのです。,False
14,恋愛がうまくいかない時は、相手を責める前に自分の選択基準を見直してみてください。いつも同じようなタイプに惹かれていませんか。ドキドキする相手ばかり選んでいませんか。安心感より刺激を求めていませんか。幸せな恋愛をしたいなら、選ぶ基準を変える必要があります。安定した愛を与えてくれる人を選ぶ勇気を持ってください。,False
15,女性が幸せになるために必要なのは、完璧な男性ではなく成長する男性です。最初から全てができる人なんていません。大切なのは、あなたと一緒に成長しようとする姿勢があるかどうかです。失敗しても謝れる、間違いを認められる、改善しようと努力する。そんな男性となら、素敵な未来を築いていけるのです。,False
16,本当に価値のある関係は、お互いが自然体でいられる関係です。背伸びしなくていい、着飾らなくていい、素顔を見せても愛してくれる。そんな関係こそが、長続きする幸せな関係です。相手の前で演技をし続ける恋愛は疲れるだけです。ありのままのあなたを受け入れてくれる人を見つけてください。それが本物の愛です。,False
17,男性の愛情表現は人それぞれですが、共通しているのは一貫性です。本当に愛している男性は、気分によって態度を変えません。機嫌が悪い時でもあなたを傷つけない、忙しい時でも思いやりを忘れない、どんな時でも敬意を持って接してくれる。そういう一貫した愛情こそが、信頼できる関係の基盤となるのです。,False
18,恋愛において後悔することの多くは、自分の気持ちを正直に伝えなかったことです。好きと言えなかった、嫌と言えなかった、本音を隠し続けた。そんな後悔をしないためにも、勇気を出して正直になってください。あなたの本音を受け止めてくれない相手なら、そもそも一緒にいる価値はありません。正直さが幸せへの第一歩です。,False
19,結婚を考えるべき相手は、あなたの家族や友人を大切にしてくれる人です。あなただけでなく、あなたの大切な人たちも尊重してくれる。そんな人となら、温かい家庭を築けます。逆に、あなたの人間関係を否定したり、孤立させようとする人は危険です。愛は独占ではなく、お互いの世界を豊かにするものなのです。,False
20,恋愛で疲れた時は、無理に次の恋を探す必要はありません。一人の時間を大切にして、自分自身と向き合ってください。趣味を楽しむ、友達と過ごす、新しいことに挑戦する。そうやって自分を充実させていると、自然と素敵な出会いがやってきます。焦らずに、今の自分を大切にすることが、次の幸せへの準備なのです。,False
21,恋愛における最大の間違いは、相手のポテンシャルに恋をすることです。「この人は変わってくれるはず」「本当はいい人なんだ」という期待は、あなたを苦しめるだけです。今現在の相手の姿を見てください。今大切にしてくれない人が、将来大切にしてくれる保証はどこにもありません。現実を見る勇気を持つことが、幸せへの第一歩なのです。,False
22,女性が男性を見極める時に注目すべきは、あなたへの態度だけではありません。店員さんへの態度、家族への接し方、友人との関わり方。そこに本当の人間性が現れます。あなたにだけ優しくて、他の人には冷たい男性は要注意です。本当に心の優しい人は、誰に対しても思いやりを持って接することができるのです。,False
23,付き合いたての頃は毎日連絡をくれたのに、今は既読スルーが当たり前。そんな変化に悩む女性は多いです。でも考えてみてください、本当に大切な人への気持ちは時間とともに深まるものです。連絡が減るのは愛が冷めたからです。「男はそういうもの」という言い訳に騙されないでください。愛があれば、行動は変わらないのです。,False
24,自立した女性ほど、甘え下手で損をすることがあります。でも本当の強さとは、弱さを見せられることです。完璧である必要はありません。疲れた時は疲れたと言っていい、助けが必要な時は助けを求めていい。そんなあなたの素直な姿を受け止めてくれる人こそ、本当のパートナーです。強がらずに、素直になってください。,False
25,恋愛がうまくいく女性は、減点法ではなく加点法で相手を見ています。完璧を求めるのではなく、良いところを見つけて感謝する。小さな優しさに気づいて喜ぶ。そういう女性の周りには、自然と愛が集まってきます。相手の欠点ばかり探していては、幸せは遠のくばかりです。良いところに目を向ける習慣を持ってください。,False
26,別れを告げられた時、多くの女性は自分を責めます。でも実は、相性が合わなかっただけなのです。あなたに魅力がないわけではありません。ただ、その人とは縁がなかっただけです。別れは新しい出会いへの扉です。もっと素敵な人があなたを待っています。自分を責めるのではなく、次の幸せに向かって前を向いてください。,False
27,男性が「重い」と言う時、それはあなたが重いのではなく、彼の愛が軽いのです。本当に愛している相手からの愛情は、どんなに深くても重荷にはなりません。むしろもっと欲しいと思うものです。あなたの愛を「重い」と感じる人は、そもそもあなたにふさわしくないのです。あなたの深い愛を喜んで受け止めてくれる人を選んでください。,False
28,健全な恋愛関係では、ケンカをしても関係が深まります。なぜなら、お互いの本音を知り、理解し合い、歩み寄ることができるからです。でも不健全な関係では、ケンカのたびに傷が深くなります。建設的な話し合いができない相手とは、いくら愛があっても幸せにはなれません。ケンカの仕方で、相手の本質が見えるのです。,False
29,恋愛において女性が陥りやすい罠は、「彼なしでは生きていけない」という思い込みです。でも実際は、あなたは一人でも十分生きていけます。彼はあなたの人生を豊かにする存在であって、人生のすべてではありません。この認識を持つことで、対等な関係が築けます。依存ではなく、選択として一緒にいることが大切なのです。,False
30,本当に幸せなカップルは、SNSでアピールしなくても幸せです。むしろ、二人だけの時間を大切にしています。人に見せるための恋愛ではなく、お互いのための恋愛をしているからです。周りからどう見えるかより、二人がどう感じるかを大切にしてください。それが本物の幸せな関係を築く秘訣なのです。,False
31,恋愛で最も危険なのは、相手の可能性に賭けることです。「いつか変わってくれる」「本当は優しい人」という希望的観測は、あなたの貴重な時間を奪います。人は自分が変わりたいと思った時にしか変わりません。あなたがどんなに愛しても、相手を変えることはできないのです。今のままの相手を受け入れられないなら、離れる勇気を持ってください。,False
32,男性の本音は、特別な瞬間ではなく日常の中に現れます。疲れている時の態度、ストレスを感じている時の言葉遣い、機嫌が悪い時の振る舞い。そういう時にこそ、本当の人間性が見えるのです。デートの時だけ優しい男性より、どんな時でも思いやりを忘れない男性を選んでください。日常を共にする相手だからこそ、普段の姿が大切なのです。,False
33,「私といると幸せ？」と聞かなければ分からない関係は、すでに答えが出ています。本当に幸せな関係なら、言葉にしなくても伝わってきます。彼の表情、行動、態度のすべてが愛を語っているはずです。不安を感じるのは、あなたの勘が正しいからです。その違和感を無視せず、自分の感覚を信じて行動してください。,False
34,恋愛上手な女性は、自分の時間を大切にします。彼とのデートも楽しむけれど、一人の時間も充実させる。友達との約束も大切にする。趣味や仕事にも打ち込む。そうやってバランスの取れた生活をしている女性は、男性から見ても魅力的です。彼だけが人生のすべてにならないよう、自分の世界を持ち続けてください。,False
35,付き合う前と付き合った後で態度が変わる男性は信用できません。釣った魚に餌をやらないタイプです。本当に愛している男性は、付き合ってからもずっとあなたを大切にします。むしろ時間とともに愛情は深まっていくものです。急に冷たくなったり、雑な扱いをするようになったら、それは愛ではなく征服欲だったということです。,False
36,女性が幸せな恋愛をするために必要なのは、自分の基準を明確にすることです。どんな扱いは許せないか、どんな関係を望むか、何を大切にしたいか。これらをはっきりさせておけば、相手選びで失敗することが減ります。妥協してはいけない部分を妥協すると、必ず後悔します。自分の基準を大切にしてください。,False
37,恋愛において沈黙は金ではありません。思っていることを言わずに我慢していても、相手には伝わりません。男性は察することが苦手です。してほしいこと、やめてほしいこと、感じていることを言葉にしてください。それで離れていく相手なら、そもそも合わなかったということです。コミュニケーションが取れる相手を選んでください。,False
38,結婚相手を選ぶ時は、最高の時だけでなく最悪の時を想像してください。病気の時に看病してくれるか、失業した時に支えてくれるか、老いても愛してくれるか。人生は山あり谷ありです。楽しい時だけ一緒にいる相手ではなく、苦しい時も共に乗り越えてくれる相手を選んでください。それが本当のパートナーです。,False
39,自己犠牲を愛だと勘違いしている女性が多いです。でも本当の愛は、お互いが幸せになることです。あなたが我慢ばかりしている関係は、愛ではなく依存です。健全な関係では、二人とも笑顔でいられます。あなたの幸せを願わない相手は、あなたを愛していません。自分を大切にすることが、愛される第一歩なのです。,False
40,恋愛の終わりは、新しい始まりです。別れを経験するたびに、あなたは強くなり、賢くなっていきます。何が嫌だったか、何を求めているか、どんな人と幸せになれるか。すべての経験が、次の恋愛への学びになります。過去を引きずるのではなく、経験を活かして前に進んでください。もっと素敵な恋があなたを待っています。,False
41,恋愛において多くの女性が見落としがちなのは、相手の過去の恋愛パターンです。元カノたちとどんな別れ方をしたか、なぜ関係が終わったか。そこには重要なヒントが隠されています。いつも相手のせいにする男性は、あなたとの関係でも同じことをします。過去から学ばない人は、同じ失敗を繰り返すものです。パターンを見極めてください。,False
42,本当に愛している男性は、あなたの成功を心から喜びます。仕事での昇進、資格の取得、夢への挑戦。すべてを応援してくれます。逆に、あなたの成功に嫉妬したり、足を引っ張ろうとする男性は要注意です。愛とは相手の幸せを願うことです。あなたが輝くことを恐れる男性ではなく、一緒に成長できる男性を選んでください。,False
43,恋愛で苦しんでいる時、友達のアドバイスを聞くことは大切です。でも最終的に決めるのはあなた自身です。なぜなら、その関係の中にいるのはあなただけだからです。他人の意見に流されすぎず、自分の心の声を聞いてください。あなたが感じている違和感や不安は、大切なサインです。自分の直感を信じる勇気を持ってください。,False
44,男性があなたを本当に愛しているかは、あなたが弱っている時の態度でわかります。体調が悪い時、仕事で失敗した時、気分が落ち込んでいる時。そんな時に寄り添ってくれるか、面倒くさがるか。強くて元気なあなただけを愛する人ではなく、弱さも含めて愛してくれる人を選んでください。それが無条件の愛です。,False
45,恋愛がうまくいかない女性の特徴は、相手の言葉を信じすぎることです。「君だけだ」「結婚しよう」「愛してる」。でも行動が伴わない言葉に価値はありません。本当の愛は行動で示されます。約束を守る、時間を作る、大切にする。言葉より行動を見てください。行動こそが、相手の本当の気持ちを教えてくれます。,False
46,別れた後に友達でいようと言う男性には気をつけてください。多くの場合、都合の良い関係を続けたいだけです。本当に終わった関係なら、距離を置くべきです。中途半端な関係は、あなたが前に進むことを妨げます。新しい恋愛のチャンスも逃してしまいます。きっぱりと関係を断つ勇気が、新しい幸せへの第一歩です。,False
47,恋愛で大切なのは、タイミングです。どんなに素敵な人でも、タイミングが合わなければうまくいきません。相手が結婚を考えていない時期、仕事に集中したい時期、心の準備ができていない時期。そんな時は、無理に関係を進めようとしても苦しいだけです。タイミングが合う人を待つことも、賢明な選択なのです。,False
48,女性の幸せを真剣に考える男性は、あなたの人生設計を尊重します。結婚の時期、子供のこと、キャリアのこと。あなたの希望を聞いて、一緒に未来を考えてくれます。自分の都合だけで物事を決める男性は、パートナーとして不適格です。二人の未来は二人で決めるもの。対等な関係を築ける相手を選んでください。,False
49,恋愛において後悔しないために大切なのは、自分に正直になることです。本当は嫌なのに笑顔でいる、本当は会いたいのに我慢する、本当は別れたいのに続ける。そんな嘘は、あなたを不幸にするだけです。自分の気持ちに正直になってください。それがあなたを幸せに導く唯一の方法です。偽りの関係に、本当の幸せはありません。,False
50,本当に運命の人は、あなたが探し回らなくても現れます。必要な時に、必要な場所で、自然に出会うものです。焦って相手を探すより、自分自身を磨くことに集中してください。内面も外見も、自分を大切にしている人は輝いています。その輝きが、運命の人を引き寄せるのです。準備ができた時、素敵な出会いは必ずやってきます。,False
51,恋愛における最大の勘違いは、嫉妬が愛の証だと思うことです。束縛や監視は愛ではなく支配欲です。本当に愛している人は、相手を信頼し、自由を尊重します。あなたの交友関係を制限したり、行動を監視したりする男性は危険です。健全な愛は、お互いの世界を狭めるのではなく、広げていくものです。信頼なくして、本当の愛は成立しません。,False
52,男性の経済力より大切なのは、お金に対する価値観です。収入が多くても浪費家では困りますし、収入が少なくても堅実な人なら安心です。大切なのは、二人でお金の話ができるかどうかです。将来の計画、貯金の目標、お金の使い方。これらを話し合える相手となら、どんな経済状況でも乗り越えていけます。価値観の一致が幸せの鍵です。,False
53,恋愛で傷ついた後、すぐに次の恋を探す必要はありません。傷が癒えないまま新しい関係を始めても、同じパターンを繰り返すだけです。一人の時間を大切にして、自分と向き合ってください。なぜうまくいかなかったのか、何を学んだのか、次はどんな関係を築きたいのか。自分を見つめ直す時間が、次の幸せへの準備になります。,False
54,付き合っている時に浮気をする男性は、結婚しても浮気をします。「結婚したら変わる」という期待は捨ててください。人の本質は簡単には変わりません。今できないことは、将来もできません。誠実さは、後から身につくものではなく、最初から持っているものです。信頼できない相手との未来に、幸せはありません。,False
55,女性が恋愛で幸せになるためには、相手を見る目を養うことが大切です。外見や肩書きに惑わされず、内面を見てください。優しさ、誠実さ、思いやり、責任感。これらは時間をかけて観察しないとわかりません。急いで判断せず、じっくり相手を知ってください。本当の人間性は、日常の小さな行動に現れるものです。,False
56,恋愛において女性が陥りやすい罠は、「私が変われば関係が良くなる」という思い込みです。でも実際は、一人で頑張っても関係は改善しません。関係は二人で作るものです。あなただけが努力しても、相手が変わらなければ意味がありません。一方通行の努力は疲れるだけです。お互いが歩み寄れる相手を選んでください。,False
57,本当に愛されている女性は、不安になりません。なぜなら、相手の行動すべてが愛を証明しているからです。連絡の頻度、会う回数、記念日の過ごし方。すべてにおいて、あなたを大切にしようという気持ちが伝わってきます。不安ばかり感じる関係は、愛が足りない証拠です。安心できる愛を与えてくれる人を選んでください。,False
