id,text,used
58,恋愛で大切なのは、相手の家族との関係性です。家族を大切にしない人は、将来あなたも大切にしない可能性があります。親との関係、兄弟との関わり方、家族への態度。そこには、その人の本質が現れます。家族を尊重できる人は、あなたの家族も大切にしてくれます。家族関係は、将来を占う重要な指標なのです。,False
59,別れを決意した時、多くの女性は「もう少し頑張れば」と思います。でもその「もう少し」がいつまで続くのでしょうか。限界を感じているなら、それが答えです。我慢には限度があります。あなたの心が壊れる前に、勇気を出して決断してください。別れは終わりではなく、新しい幸せへの始まりです。自分を大切にする選択をしてください。,False
60,恋愛成就の秘訣は、相手に合わせすぎないことです。好きな人の趣味に無理に合わせたり、性格を変えようとしたりする必要はありません。本当のあなたを好きになってくれる人が、運命の人です。偽りの自分で得た愛は、いつか崩れます。素直で自然体のあなたを愛してくれる人を待ってください。その人こそが、本物です。,False
61,恋愛で一番避けるべきは、過去の栄光にすがる男性です。学生時代の武勇伝、昔のモテ話、過去の成功体験ばかり語る男性は要注意です。今現在頑張っていない人に、未来はありません。大切なのは過去ではなく現在と未来です。今も成長し続けている人、未来に向かって努力している人を選んでください。そんな人となら、素敵な未来を築けます。,False
62,女性が気をつけるべきは、恋愛初期の過度な優しさです。異常なほど優しい男性、完璧すぎる対応をする男性は、何かを隠している可能性があります。本当の優しさは、時間が経っても変わりません。むしろ深まっていくものです。最初だけ優しい男性より、ずっと変わらない優しさを持つ男性を選んでください。それが本物の愛です。,False
63,恋愛において女性が忘れがちなのは、自分にも選ぶ権利があるということです。選ばれるのを待つのではなく、自分も相手を選んでいるのです。この人でいいのか、この関係で幸せなのか、常に自問してください。妥協や諦めで続ける関係に、本当の幸せはありません。あなたには、最高の相手を選ぶ権利があるのです。,False
64,男性の本性は、お酒を飲んだ時と運転している時に現れます。酔った時に暴言を吐く、運転中にイライラする、些細なことで怒鳴る。そんな一面を見せる男性は危険です。ストレス下での振る舞いこそ、その人の本質です。普段は隠していても、いつか必ず本性は現れます。小さなサインを見逃さないでください。,False
65,恋愛がうまくいく女性は、相手に期待しすぎません。誕生日プレゼント、記念日のお祝い、サプライズ。もちろん嬉しいけれど、それがなくても不満を持ちません。日常の小さな優しさに感謝できる女性は、幸せを感じやすいのです。特別なことより、当たり前の日常を大切にできる関係こそ、長続きする幸せな関係です。,False
66,別れた相手のSNSをチェックし続けるのは、自分を苦しめるだけです。元彼が誰といるか、何をしているか、新しい彼女ができたか。知ったところで、あなたの人生は良くなりません。過去を見続けている限り、前に進めません。勇気を出してブロックしてください。見えない世界に、執着する必要はないのです。,False
67,恋愛で大切なのは、ケンカの仕方です。感情的に怒鳴る、過去の話を持ち出す、人格を否定する。そんなケンカは関係を壊すだけです。建設的な話し合いができる相手を選んでください。意見の違いを認め合い、妥協点を見つけ、一緒に解決策を考える。そんなケンカなら、むしろ関係は深まっていきます。,False
68,女性の直感は、ほぼ正しいです。「何か違う」と感じたら、その感覚を大切にしてください。理由が説明できなくても、あなたの心は真実を知っています。違和感を無視して関係を続けても、最終的には同じ結論に至ります。時間を無駄にしないためにも、自分の直感を信じる勇気を持ってください。それがあなたを守ります。,False
69,恋愛において後悔しないために必要なのは、決断力です。ずるずると関係を続けるより、はっきりと決めることが大切です。続けるなら本気で向き合う、無理なら潔く別れる。中途半端が一番良くありません。決断を先延ばしにすればするほど、傷は深くなります。勇気を出して決断してください。それが幸せへの近道です。,False
70,本当に素敵な男性は、あなたの成長を応援します。新しいことに挑戦したい、スキルを身につけたい、夢を追いかけたい。そんなあなたの想いを全力でサポートしてくれます。足を引っ張る男性、邪魔をする男性は、あなたの人生に必要ありません。一緒に成長し、高め合える関係こそ、本当に価値のある関係なのです。,False
71,恋愛で女性が見極めるべきは、男性の怒り方です。怒った時に物に当たる、大声で威嚇する、無視して罰を与える。こういう男性は将来的に危険です。健全な大人は、怒りをコントロールできます。冷静に話し合える、感情を言葉で表現できる、相手を傷つけない方法で伝えられる。そんな男性こそ、安心して未来を共にできる相手です。,False
72,幸せな恋愛の条件は、笑いの相性です。同じことで笑える、くだらない冗談で盛り上がれる、一緒にいて自然に笑顔になれる。そんな相手となら、どんな困難も乗り越えていけます。逆に、笑いのツボが合わない、楽しいと感じることが違う、一緒にいても笑えない。そんな関係は長続きしません。笑顔でいられる相手を選んでください。,False
73,恋愛において女性が陥りやすいのは、potential（可能性）を見すぎることです。今は仕事をしていないけど才能はある、今は優しくないけど本当は優しい、今は浮気しているけどいつか落ち着く。でも現実を見てください。今できないことは、将来もできない可能性が高いのです。可能性ではなく、現実を基準に判断してください。,False
74,男性の愛情表現を正しく受け取ることも大切です。言葉が少なくても、行動で示している男性もいます。あなたの好きな料理を覚えている、体調を気遣ってくれる、大切な日を忘れない。小さなサインを見逃さないでください。ただし、愛情表現が全くない場合は要注意です。愛は何かしらの形で必ず表れるものです。,False
75,恋愛で苦しい時は、第三者の視点を持つことが大切です。もし親友が同じ状況だったら、あなたは何とアドバイスしますか。きっと「そんな男やめなさい」と言うはずです。自分のことになると冷静に判断できなくなりますが、客観的に見れば答えは明確です。自分を大切な友達だと思って、優しくアドバイスしてあげてください。,False
76,結婚を考える時、相手の金銭感覚は必ずチェックしてください。ギャンブル好き、借金癖、見栄っ張りな買い物。これらは結婚後に大きな問題になります。お金の話を避ける男性も要注意です。健全な関係では、お金の話もオープンにできます。経済的な価値観が合わない相手との結婚は、不幸の始まりになりかねません。,False
77,別れを切り出されたとき、すがりつくのは逆効果です。一度離れることを決めた相手の心は、簡単には戻りません。むしろ、潔く受け入れることで、相手はあなたの価値を再認識することがあります。でも、それを期待する必要もありません。あなたにはもっと素敵な出会いが待っています。執着せず、新しい幸せに向かって進んでください。,False
78,恋愛において大切なのは、自分の境界線を明確にすることです。これは許せる、これは許せない。その線引きをはっきりさせてください。そして、その境界線を越えてくる相手には、毅然とした態度を取ってください。優しさと甘さは違います。大切にされない関係を続けることは、優しさではなく自分への裏切りです。,False
79,男性を変えようとするのは時間の無駄です。人は自分が変わりたいと思った時にしか変わりません。あなたがどんなに愛しても、尽くしても、相手が変わる保証はありません。変わることを期待するより、最初から自分に合う人を選ぶほうが賢明です。エネルギーを注ぐべきは、相手を変えることではなく、自分を高めることです。,False
80,恋愛の本質は、二人で一つになることではありません。それぞれが独立した個人として、お互いを尊重し合うことです。相手に依存するのではなく、支え合う。束縛するのではなく、信頼する。所有するのではなく、愛する。健全な距離感を保ちながら、深い絆で結ばれる。それが理想的な恋愛関係なのです。,False
81,恋愛で注意すべきは、言い訳が多い男性です。デートに遅れても言い訳、連絡が遅くても言い訳、約束を破っても言い訳。責任を取らない人は、パートナーとして信頼できません。素直に謝れる人、自分の非を認められる人、改善しようと努力する人。そういう男性こそ、一緒に人生を歩める相手です。言い訳より行動を見てください。,False
82,女性が恋愛で損をするのは、相手の機嫌を取ることに必死になる時です。機嫌が悪い彼をなだめる、怒らせないように気を使う、顔色を伺いながら生活する。それは恋愛ではなく奴隷です。大人なら自分の機嫌は自分で取るものです。あなたは彼のセラピストではありません。対等な関係を築ける相手を選んでください。,False
83,恋愛初期に気をつけるべきは、愛情爆撃です。出会ってすぐに「運命だ」と言う、毎日大量のメッセージを送る、高価なプレゼントを贈る。これらは危険信号です。健全な愛は時間をかけて育つものです。急速に燃え上がる関係は、急速に冷めることも多いです。ゆっくりと深まっていく関係こそ、本物の愛です。,False
84,男性の本当の優しさは、あなたが困っている時に分かります。体調不良の時に看病してくれる、仕事で悩んでいる時に話を聞いてくれる、家族の問題で苦しんでいる時に支えてくれる。都合の良い時だけ優しい男性は、本当の優しさを持っていません。あなたが弱っている時こそ、寄り添ってくれる人を選んでください。,False
85,恋愛がうまくいかない時、占いや恋愛テクニックに頼りたくなる気持ちは分かります。でも本当に必要なのは、自分と向き合うことです。なぜいつも同じパターンで失敗するのか、何を恐れているのか、本当は何を求めているのか。自分を理解することが、幸せな恋愛への第一歩です。外に答えを求める前に、内側を見つめてください。,False
86,別れた後も友達でいたいという提案は、ほとんどの場合うまくいきません。どちらかがまだ未練を持っていたり、都合の良い関係を続けたいだけだったりします。きれいに別れることが、お互いのためです。過去に縛られず、新しい恋愛に進むためにも、完全に関係を断つ勇気が必要です。中途半端は誰も幸せにしません。,False
87,恋愛で大切なのは、相手の友人関係を見ることです。類は友を呼びます。遊び人の友達が多い、女性を軽視する仲間といる、不誠実な人たちと付き合っている。そんな男性は要注意です。逆に、誠実な友人を持ち、長い付き合いの友達がいる、友人から信頼されている。そんな男性は信用できます。人は環境に影響されるものです。,False
88,女性が陥りやすい恋愛の罠は、救世主コンプレックスです。ダメな男を自分が救ってあげる、私がいないと彼はダメになる、私だけが彼を理解できる。これらは幻想です。あなたは彼の母親ではありません。大人の男性を育て直すのは、あなたの仕事ではないのです。最初から自立した男性を選ぶことが、幸せへの近道です。,False
89,恋愛において後悔しないために必要なのは、早めの決断です。違和感を感じたら早めに話し合う、改善が見られなければ早めに見切りをつける、幸せじゃないなら早めに別れる。ずるずると引き延ばすことで、傷は深くなり時間も無駄になります。決断を恐れないでください。間違った関係を終わらせることは、正しい選択です。,False
90,本当に価値のある男性は、あなたの過去を受け入れます。過去の恋愛、失敗、傷。すべてを含めてあなたという人間を愛してくれます。過去を責めたり、比較したり、蒸し返したりする男性は、真の愛を知りません。あなたの過去も含めて愛してくれる人こそ、未来を共にすべき相手です。過去は変えられませんが、未来は選べます。,False
91,恋愛で最も警戒すべきは、あなたを孤立させようとする男性です。友達との付き合いを制限する、家族との関係を悪くさせる、趣味や仕事を辞めさせようとする。これらは支配の始まりです。健全な愛は、あなたの世界を広げます。狭めようとする男性は、愛ではなく所有欲に駆られています。自由を奪う相手からは、すぐに離れてください。,False
92,女性が見落としがちなのは、男性の母親との関係です。マザコンすぎる男性は問題ですが、母親を大切にできない男性も危険です。女性として最初に関わる母親との関係は、将来のパートナーとの関係に影響します。適度な距離感を保ちながら、敬意を持って接している男性が理想的です。家族関係は結婚後の生活を左右します。,False
93,恋愛において大切なのは、相手の努力を見ることです。完璧な人間はいません。大切なのは、あなたのために努力してくれるかどうかです。苦手なことでも挑戦する、間違いを認めて改善する、あなたの要望に応えようとする。そんな姿勢が見える男性は、長期的に良いパートナーになります。結果より過程を評価してください。,False
94,男性の本質は、ストレスがかかった時に現れます。仕事が忙しい時、お金に困った時、プレッシャーを感じた時。そんな時でもあなたを大切にできるか、八つ当たりしないか、思いやりを忘れないか。ストレス下での振る舞いこそ、その人の真の姿です。良い時だけでなく、悪い時の態度も観察してください。,False
95,恋愛で幸せになれない女性の特徴は、自分より相手を優先することです。自分の意見より彼の意見、自分の予定より彼の予定、自分の幸せより彼の幸せ。でも本当の愛は、どちらかが犠牲になることではありません。お互いが幸せになることです。自分を大切にできない人は、相手からも大切にされません。まず自分を優先してください。,False
96,別れを考えている時、多くの女性は「もったいない」と感じます。費やした時間、注いだ愛情、共有した思い出。でもこれらは沈没コストです。過去に投資したものは戻ってきません。大切なのは、これから先の人生です。不幸な関係を続けることこそ、本当にもったいないのです。過去より未来を大切にする勇気を持ってください。,False
97,恋愛において注意すべきは、二面性のある男性です。あなたの前では優しいのに、他人には冷たい。表では紳士なのに、裏では暴言を吐く。仕事では真面目なのに、プライベートではだらしない。どちらが本当の姿でしょうか。答えは両方です。いつかあなたにも、隠していた面を見せる時が来ます。一貫性のある人を選んでください。,False
98,女性の恋愛における最大の武器は、去る勇気です。大切にされない関係から去る、愛のない男から去る、不誠実な相手から去る。この勇気があるかないかで、人生は大きく変わります。しがみつくほど、相手はあなたを軽く見ます。去る勇気を持つことで、本当に大切にしてくれる人と出会えるのです。,False
99,恋愛で大切なのは、価値観の一致です。お金の使い方、子供の育て方、人生の優先順位。これらが合わない相手とは、いずれ衝突します。愛があれば乗り越えられると思うかもしれませんが、価値観の違いは愛では埋められません。付き合う前に、しっかり話し合ってください。妥協できる部分とできない部分を明確にすることが大切です。,False
100,本当に素敵な男性は、あなたの「NO」を尊重します。今日は会いたくない、それは嫌だ、そこには行きたくない。あなたの意思を尊重し、無理強いしません。逆に、あなたの「NO」に怒る男性、機嫌が悪くなる男性、罪悪感を植え付ける男性は危険です。「NO」と言える関係こそ、健全な関係なのです。,False
101,恋愛で失敗する女性の多くは、相手の「今」ではなく「いつか」に期待しています。いつか結婚してくれる、いつか優しくなる、いつか浮気をやめる。でも「いつか」は永遠に来ないかもしれません。大切なのは今この瞬間です。今大切にしてくれない人が、未来で大切にしてくれる保証はどこにもありません。現在を基準に判断してください。,False
102,男性の愛情の深さは、細かい配慮に表れます。あなたの好きな飲み物を覚えている、寒がりなことを知っていて上着を貸してくれる、生理中は優しく接してくれる。こういう小さな思いやりの積み重ねが、本当の愛です。大きなサプライズより、日常の小さな優しさを大切にしてくれる人を選んでください。そこに真実の愛があります。,False
103,恋愛において女性が注意すべきは、共依存関係です。彼なしでは生きていけない、彼も私なしではダメになる。一見美しい関係に見えますが、これは不健全です。健全な関係は、一人でも生きていけるけど、一緒にいることを選ぶ関係です。依存ではなく、選択であることが大切です。自立した上での愛こそ、本物の愛なのです。,False
104,別れ話をする時、相手の本性が最もよく現れます。感謝の気持ちを伝える人、罵詈雑言を浴びせる人、ストーカーになる人、すぐに次の女性を見つける人。別れ方にその人の人間性が表れます。もし今の彼と別れることになったら、どんな別れ方をされるか想像してみてください。それが彼の本当の姿かもしれません。,False
105,恋愛がうまくいく女性は、相手に多くを求めません。完璧な彼氏、理想の関係、映画のような恋愛。そんなものは存在しないと知っているからです。大切なのは、お互いの不完全さを受け入れ、一緒に成長していくことです。高すぎる理想は、幸せを遠ざけます。現実的な期待を持つことが、幸せな恋愛の秘訣です。,False
106,男性を見極める時は、約束への姿勢を見てください。小さな約束も守る、できない約束はしない、守れなかった時は謝る。約束を軽く考える男性は、あなたとの関係も軽く考えています。「そんな約束したっけ？」と言う男性は論外です。約束を大切にする人は、人間関係も大切にします。信頼の基本は約束を守ることです。,False
107,恋愛で苦しんでいる時、その苦しみには意味があります。その関係があなたに合っていないというサインです。本当に良い関係は、苦しみより喜びが多いものです。不安より安心が多く、涙より笑顔が多い。苦しみに耐えることが愛ではありません。苦しみから解放されることこそ、自分への愛です。その勇気を持ってください。,False
108,女性が恋愛で幸せになるコツは、比較をやめることです。友達の彼氏と比較、理想の恋愛と比較、過去の恋愛と比較。比較は不満を生むだけです。あなたの恋愛は、あなただけのものです。他人と比べる必要はありません。今ある幸せに感謝し、目の前の相手を大切にすることが、本当の幸せへの道なのです。,False
109,恋愛において重要なのは、相手の成長意欲です。現状に満足して努力しない男性は、将来性がありません。仕事でも趣味でも、何かに向かって努力している男性は魅力的です。一緒にいることで、あなたも刺激を受けて成長できます。停滞している男性より、前進している男性を選んでください。共に成長できる関係が理想です。,False
110,本当の愛は、条件付きではありません。痩せたら愛する、言うことを聞いたら優しくする、機嫌が良い時だけ大切にする。これらは愛ではなく取引です。無条件にあなたを受け入れ、そのままのあなたを愛してくれる人を選んでください。条件付きの愛は、いつか条件を満たせなくなった時に消えてしまいます。無条件の愛こそ本物です。,False
111,恋愛で気をつけるべきは、感情の起伏が激しい男性です。今日は天使のように優しいのに、明日は悪魔のように冷たい。この繰り返しは、あなたの心を疲弊させます。安定した愛情を注いでくれる人こそ、信頼できるパートナーです。ジェットコースターのような関係は刺激的かもしれませんが、長期的には心が壊れてしまいます。穏やかな愛を選んでください。,False
112,女性が恋愛で損をするのは、彼の可能性に投資し続ける時です。時間も、お金も、愛情も注ぎ続けて、いつか花開くことを期待する。でも投資には見切りも必要です。リターンが見込めない投資は、損切りする勇気が必要です。あなたの人生は有限です。見込みのない相手に費やす時間はありません。賢明な判断をしてください。,False
113,恋愛において大切なのは、日常会話の質です。特別な話題じゃなくても楽しく話せる、沈黙も心地よい、くだらない話で笑い合える。これが長続きする関係の秘訣です。デートの時だけ盛り上がる関係は、結婚後に苦労します。普通の日常を一緒に楽しめる相手こそ、人生のパートナーにふさわしい人です。,False
114,男性の誠実さは、女性関係への態度で分かります。元カノの悪口を言わない、女友達との距離感が適切、職場の女性を尊重している。逆に、元カノを悪者にする、女友達と曖昧な関係、女性を見下す発言をする。こういう男性は危険です。女性全般への接し方が、将来のあなたへの接し方になります。よく観察してください。,False
