id,text,used
173,恋愛において大切なのは、問題解決のスタイルです。問題から逃げる人、問題を大きくする人、問題を相手のせいにする人。こういう人とは、幸せな未来は築けません。問題に向き合う人、解決策を考える人、協力して乗り越える人。そういう人を選んでください。人生は問題の連続です。一緒に解決できる相手が必要です。,False
174,男性の成熟度は、感情のコントロール力で分かります。イライラしても物に当たらない、悲しくても八つ当たりしない、嬉しくても調子に乗らない。感情に振り回される男性は、あなたも振り回します。感情を認識し、適切に表現できる男性を選んでください。感情的な安定は、関係の安定につながります。,False
175,恋愛で幸せになれない女性は、比較の罠にはまっています。SNSで見る理想のカップル、友人の彼氏、過去の恋人。比較は不満を生むだけです。あなたの恋愛は唯一無二です。他人と比べる必要はありません。目の前の関係に集中し、自分たちのペースで進んでください。比較をやめた時、本当の幸せが見えてきます。,False
176,別れた後の成長は、次の恋愛の質を決めます。なぜうまくいかなかったのか、自分の何を改善すべきか、次はどんな人を選ぶべきか。この振り返りをせずに次に進むと、同じ失敗を繰り返します。痛みから学び、成長してください。失恋は卒業です。次のステージに進むための、大切な学びの機会なのです。,False
177,恋愛において注意すべきは、言行不一致の男性です。「愛している」と言いながら大切にしない、「結婚したい」と言いながら行動しない、「君だけだ」と言いながら他の女性と連絡を取る。言葉と行動が一致しない時、行動を信じてください。言葉は簡単に嘘をつきますが、行動は真実を語ります。,False
178,女性の恋愛における誤解は、尽くせば愛されるという思い込みです。でも一方的に尽くすほど、相手はあなたを当たり前だと思うようになります。健全な関係は、ギブアンドテイクです。与えるだけでなく、受け取ることも大切です。相手からの愛情を素直に受け取れる女性こそ、愛され続ける女性なのです。,False
179,恋愛で大切なのは、将来のビジョンの共有です。結婚観、子供の有無、住む場所、ライフスタイル。これらが大きく違う相手とは、いずれ別れることになります。愛があっても、人生の方向性が違えば一緒にいられません。早い段階で将来の話をしてください。ビジョンが合う人こそ、人生のパートナーです。,False
180,本当に愛してくれる男性は、あなたの人生を豊かにします。新しい経験をさせてくれる、成長の機会を与えてくれる、世界を広げてくれる。逆に、あなたの世界を狭める男性、可能性を潰す男性、成長を妨げる男性は、愛ではなく支配を求めています。あなたの人生がより豊かになる相手を選んでください。,False
181,恋愛で最も見落とされがちなのは、相手の習慣です。毎日の小さな習慣が、その人の人生を作ります。早起きする、運動する、読書する、感謝を口にする。良い習慣を持つ人は、良い未来を作ります。逆に、夜更かし、暴飲暴食、ギャンブル、愚痴ばかり。悪い習慣を持つ人と一緒にいると、あなたも引きずられます。習慣は伝染するのです。,False
182,女性が恋愛で損をするのは、可能性に賭け続ける時です。「いつか」プロポーズしてくれる、「いつか」仕事を見つける、「いつか」優しくなる。でも賭けには期限を設けるべきです。1年待って変わらないなら、10年待っても変わりません。期限を決めて、それまでに変化がなければ見切りをつける勇気を持ってください。,False
183,恋愛において大切なのは、お金の話ができる関係です。収入、貯金、借金、将来の経済計画。これらをオープンに話せない相手とは、結婚すべきではありません。お金の問題は、離婚原因の上位です。恥ずかしがらず、隠さず、正直に話してください。経済的な透明性がある関係こそ、信頼できる関係です。,False
184,男性の誠実さは、小さな約束を守るかどうかで分かります。「電話する」と言ったら電話する、「迎えに行く」と言ったら迎えに行く、「覚えておく」と言ったら覚えている。大きな約束の前に、小さな約束を守れない人を信用してはいけません。小さなことを大切にする人こそ、大きなことも大切にできるのです。,False
185,恋愛で苦しむ女性の特徴は、現実より願望を見ることです。彼はこうあってほしい、関係はこうなってほしい、将来はこうなるはず。でも願望は現実ではありません。今ある現実を直視してください。願望に生きると失望しますが、現実に生きれば正しい選択ができます。現実を受け入れることが、変化の第一歩です。,False
186,別れを選んだ自分を責めないでください。続けることが愛ではありません。時には、離れることが最大の愛の表現です。お互いが不幸になる関係を続けるより、離れて幸せになる方が健全です。別れは失敗ではなく、卒業です。次のステージに進む勇気を持ったあなたを、褒めてあげてください。,False
187,恋愛において警戒すべきは、被害者意識の強い男性です。すべてが自分以外のせい、いつも自分だけが損をしている、世界が自分に冷たい。こういう男性は、あなたも加害者にします。被害者意識は、責任逃れの表れです。自分の人生に責任を持てる人、前向きに生きる人を選んでください。,False
188,女性の恋愛における間違いは、母性で男性を包もうとすることです。ダメな男ほど母性本能をくすぐりますが、それは罠です。あなたは彼の母親ではなく、パートナーです。育てる対象ではなく、共に歩む相手を選んでください。大人の男性を子供扱いすると、本当に子供のように振る舞い始めます。,False
189,恋愛で大切なのは、静かな時間を共有できるかです。常に会話が必要、常に刺激が必要、常に何かしていないと気まずい。これでは疲れます。同じ空間にいるだけで心地良い、沈黙も苦にならない、ただ一緒にいるだけで幸せ。そんな関係こそ、本物です。静寂を共有できる相手と、人生を共有してください。,False
190,本当に価値のある男性は、あなたの独立を応援します。自分の時間を持つこと、自分の趣味を楽しむこと、自分の友人と会うこと。これらを制限せず、むしろ推奨します。依存関係ではなく、自立した二人が選び合う関係。それが理想です。お互いの自由を尊重できる関係こそ、長続きする幸せな関係なのです。,False
191,恋愛で見極めるべきは、相手の余裕です。心に余裕がない男性は、あなたを幸せにできません。仕事でいっぱいいっぱい、お金でカツカツ、時間に追われている。余裕がない人は、優しさも愛情も示せません。今は無理でも、将来的に余裕を作ろうとしている人なら待つ価値があります。でも永遠に余裕がない人生を選ぶ人からは離れてください。,False
192,女性が恋愛で陥る罠は、サンクコスト効果です。3年付き合ったから、同棲したから、親に紹介したから。だから別れられない。でも過去の投資は理由になりません。大切なのは、この先も一緒にいたいかどうかです。過去に縛られて未来を犠牲にしないでください。今が別れ時なら、過去がどうであれ別れるべきです。,False
193,恋愛において大切なのは、健康への意識です。タバコ、過度の飲酒、不規則な生活、運動不足。これらは将来大きな問題になります。健康を大切にしない人は、あなたの健康も大切にしません。一緒に歳を重ねていく相手だからこそ、健康意識は重要です。共に健康で長生きできる相手を選んでください。,False
194,男性の本気度は、あなたへの時間投資で分かります。どんなに忙しくても時間を作る、予定を調整してでも会う、あなたとの時間を優先する。時間は有限で貴重です。その時間をあなたに使うということは、本気の証です。「時間がない」を言い訳にする男性は、あなたが優先順位の下位にいるということです。,False
195,恋愛で幸せになれない女性は、悪いものを良く解釈する癖があります。冷たさを「クールな性格」、無関心を「信頼の証」、放置を「自由を与えてくれる」。ポジティブ思考と現実逃避は違います。悪いものは悪いと認識してください。正しい認識なくして、正しい判断はできません。現実を美化せず、ありのままを見てください。,False
196,別れた後、復縁を考えるのは自然なことです。でも別れた理由を思い出してください。その理由は解決しましたか？同じ人と同じ問題で悩むより、新しい人と新しい幸せを探す方が建設的です。過去の扉を閉めることで、新しい扉が開きます。後ろを振り返らず、前を向いて歩いてください。,False
197,恋愛において注意すべきは、愛情と執着の違いです。執着は相手を縛り、コントロールしようとします。愛情は相手を自由にし、幸せを願います。あなたが感じているのは、どちらですか？そして相手から向けられているのは、どちらですか？執着を愛と勘違いしないでください。本物の愛は、自由の中で育ちます。,False
198,女性の恋愛における最大の資産は、自己愛です。自分を愛せる女性は、他人からも愛されます。自分を大切にする女性は、他人からも大切にされます。まず自分との関係を良好にしてください。自分を褒める、自分に優しくする、自分を許す。自己愛が高まると、自然と良い恋愛を引き寄せるようになります。,False
199,恋愛で大切なのは、成長の方向性です。二人が同じ方向に成長しているか、それとも違う方向に向かっているか。価値観、目標、ライフスタイル。これらが diverge（離れていく）なら、関係も離れていきます。converge（収束する）方向に進む相手を選んでください。共に成長できる関係が、最も価値があります。,False
200,本当に素敵な男性は、あなたの意見を変えようとしません。政治観、宗教観、人生観。違いがあっても尊重し、理解しようとします。自分の考えを押し付ける男性は、あなたを一人の人間として見ていません。意見の相違を受け入れられる器の大きさこそ、真の成熟です。違いを楽しめる相手を選んでください。,False
