id,text,used
115,恋愛で幸せになれない女性は、自己犠牲を美徳だと思っています。でも自分を犠牲にして得た愛は、本物の愛ではありません。本当の愛は、あなたが自分らしくいることを喜んでくれます。我慢や犠牲を強いる関係は、愛ではなく支配です。自分を大切にしながら、相手も大切にできる。そんなバランスの取れた関係を目指してください。,False
116,別れた後に後悔することの多くは、もっと早く別れなかったことです。違和感を感じていたのに無視した、友達の忠告を聞かなかった、明らかな赤信号を見逃した。過去は変えられませんが、次は同じ失敗をしないでください。違和感は心からの警告です。その声を無視せず、勇気を持って行動することが、幸せへの道です。,False
117,恋愛において注意すべきは、経済的に依存させようとする男性です。仕事を辞めさせる、お金の管理をしたがる、経済的な自立を妨げる。これらは支配の手段です。経済的自立は、精神的自立の基盤です。どんなに愛していても、自分の収入源は確保してください。依存は愛ではありません。自立した上での愛こそ、健全な愛です。,False
118,女性の直感が働く瞬間を大切にしてください。彼の嘘を見抜く、浮気を察知する、別れの予感を感じる。この直感は、ほとんどの場合正しいです。論理的に説明できなくても、心が知っているのです。直感を「考えすぎ」と片付けないでください。それは、あなたを守ろうとする心からのメッセージです。信じる勇気を持ってください。,False
119,恋愛で大切なのは、お互いの成長を喜び合える関係です。昇進を妬む、成功を素直に喜べない、成長を恐れる。こんな相手とは幸せになれません。本当のパートナーは、あなたの成功を自分のことのように喜び、さらなる成長を応援してくれます。競争ではなく協力、嫉妬ではなく応援。そんな関係を築ける相手を選んでください。,False
120,本当に愛してくれる男性は、あなたの時間を尊重します。急な呼び出しをしない、予定を勝手に変えない、待たせることを申し訳なく思う。時間は命そのものです。あなたの時間を粗末に扱う人は、あなたの人生も粗末に扱います。時間を大切にしてくれる人こそ、あなたを大切に思っている証拠です。その違いを見極めてください。,False
121,恋愛で見落としがちなのは、相手の「ごめん」の質です。ただ口で謝るだけの人と、行動で示す人は違います。同じ過ちを繰り返しながら謝り続ける男性は、あなたを軽く見ています。本当の謝罪は、二度と同じことをしないという行動変化を伴います。言葉だけの「ごめん」に騙されないでください。行動こそが真実を語ります。,False
122,女性が恋愛で傷つくのは、明確な拒絶より曖昧な態度です。好きなのか嫌いなのか分からない、付き合っているのかいないのか分からない、将来があるのかないのか分からない。この曖昧さが、あなたの心を蝕みます。はっきりしない関係は、相手があなたを本気で選んでいない証拠です。明確な答えを求める勇気を持ってください。,False
123,恋愛において大切なのは、相手の「忙しい」の使い方です。本当に忙しくても、大切な人には時間を作るものです。5分の電話、1通のメッセージ、短い休憩時間の連絡。愛があれば、どんなに忙しくても繋がりを保とうとします。「忙しい」を言い訳にして放置する人は、あなたを優先順位の下位に置いています。その現実を受け入れてください。,False
124,男性の器の大きさは、あなたの成功への反応で分かります。小さな器の男性は、あなたの成功を脅威と感じ、足を引っ張ろうとします。大きな器の男性は、あなたの成功を誇りに思い、さらなる高みへ押し上げてくれます。あなたが輝くことを恐れる男性ではなく、一緒に輝こうとする男性を選んでください。それが幸せの条件です。,False
125,恋愛で苦しむ女性の特徴は、相手の言葉を都合よく解釈することです。「今は無理」を「いつかは大丈夫」と解釈し、「君は特別」を「愛している」と解釈する。でも言葉通りに受け取ってください。「今は無理」は「無理」であり、「君は特別」は「愛している」ではありません。希望的観測は、現実から目を背けるだけです。,False
126,別れを選ぶ勇気が出ない時、想像してみてください。5年後、10年後の自分を。同じ悩みを抱え、同じ涙を流し、同じ場所で立ち止まっている自分を見たいですか。それとも、新しい幸せを掴み、笑顔で過ごしている自分を見たいですか。今の決断が、未来のあなたを作ります。未来の自分のために、勇気を出してください。,False
127,恋愛において警戒すべきは、あなたの幸せを喜ばない男性です。友達と楽しそうにしていると不機嫌になる、趣味を楽しんでいると文句を言う、仕事での成功を素直に喜ばない。こういう男性は、あなたの幸せより自分のプライドを優先します。本当の愛は、相手の幸せを願うものです。あなたの幸せを奪う人からは離れてください。,False
128,女性が陥りやすいのは、恋愛を人生の中心に置くことです。でも恋愛は人生の一部であって、すべてではありません。仕事も、趣味も、友人も、家族も、すべてが大切です。恋愛だけに依存すると、失った時に何も残りません。バランスの取れた充実した人生を送ることが、結果的に良い恋愛を引き寄せるのです。,False
129,恋愛で大切なのは、相手の「普通」を知ることです。普通の日の過ごし方、普通の機嫌、普通の優しさ。特別な日だけ優しい人より、普通の日も優しい人を選んでください。人生の大部分は普通の日です。その普通を一緒に幸せに過ごせる相手こそ、本当のパートナーです。非日常より日常を大切にしてください。,False
130,本当に価値のある男性は、あなたの「嫌だ」を尊重します。これは嫌、それはしたくない、そこには行きたくない。あなたの気持ちを大切にし、強要しません。「嫌だ」と言えない関係、言っても聞いてもらえない関係は、健全ではありません。お互いの気持ちを尊重し合える関係こそ、長続きする幸せな関係なのです。,False
131,恋愛で最も避けるべきは、あなたを下に見る男性です。学歴、収入、容姿、何かにつけてマウントを取ろうとする。本当の愛は対等な関係から生まれます。上下関係がある恋愛は、いずれ破綻します。あなたを見下す人ではなく、リスペクトしてくれる人を選んでください。尊敬し合える関係こそ、本物の愛が育つ土壌なのです。,False
132,女性が恋愛で気づくべきは、彼の「変わる」という言葉の信憑性です。浮気がバレて「変わる」、暴言を吐いて「変わる」、約束を破って「変わる」。でも人は簡単には変わりません。特に、外圧で変わろうとする人は、喉元過ぎれば元に戻ります。自発的に変わろうとしない人の「変わる」を信じないでください。それは時間稼ぎの言葉です。,False
133,恋愛において大切なのは、二人の温度差を認識することです。あなたは結婚を考えているのに、彼はまだ遊びたい。あなたは毎日会いたいのに、彼は週一で十分。この温度差は、愛の差です。同じ温度で愛し合える人を見つけてください。一方的に熱い恋も、一方的に冷めた恋も、長続きしません。バランスが大切です。,False
134,男性の本質は、プレッシャーがかかった時に現れます。締切に追われた時、トラブルが起きた時、計画が狂った時。そんな時でも冷静でいられるか、八つ当たりしないか、あなたへの態度が変わらないか。ストレス耐性の低い男性は、結婚後に問題になります。人生は予期せぬことの連続です。どんな時でも安定している人を選んでください。,False
135,恋愛で幸せになれない女性は、「私なんて」が口癖です。私なんて可愛くない、私なんて価値がない、私なんて愛される資格がない。この自己否定が、ダメな男を引き寄せます。自分を大切にしない人は、他人からも大切にされません。まず自分で自分の価値を認めてください。それが幸せな恋愛の第一歩です。,False
136,別れた後、元彼の幸せを願えるようになったら、あなたは本当に前に進めた証拠です。憎しみや執着は、あなたを過去に縛り付けます。相手の幸せを願えるということは、自分の幸せに集中できるということです。それは弱さではなく、強さの表れです。過去を手放し、未来を掴む準備ができたということなのです。,False
137,恋愛において注意すべきは、責任転嫁する男性です。仕事がうまくいかないのは上司のせい、人間関係がうまくいかないのは相手のせい、人生がうまくいかないのは環境のせい。自分の人生に責任を持てない人は、あなたとの関係にも責任を持てません。言い訳ばかりの男性より、自分で道を切り開く男性を選んでください。,False
138,女性の恋愛における最大の敵は、不安です。連絡が来ない不安、愛されているか分からない不安、捨てられるかもしれない不安。でもこの不安は、相手が作り出しているものです。本当に愛してくれる人は、あなたを不安にさせません。安心感を与えてくれる関係こそ、健全な関係です。不安ばかりの恋愛から、卒業してください。,False
139,恋愛で大切なのは、相手の家事能力です。料理、掃除、洗濯。これらを「女の仕事」と思っている男性は論外です。家事は生活の基本であり、二人で分担するものです。一人暮らしの経験がない、実家暮らしで何もしない、家事を軽視している。こういう男性との結婚は苦労します。生活力のある男性を選んでください。,False
140,本当に素敵な男性は、あなたの涙を軽く扱いません。なぜ泣いているのか理解しようとし、慰め、二度と同じ涙を流させないよう努力します。「また泣いてる」「めんどくさい」「大げさだ」と言う男性は、あなたの心を大切にしていません。涙は心からのメッセージです。それを受け止めてくれる人を選んでください。,False
141,恋愛で失敗する女性は、相手の行動より言い訳を信じます。「仕事が忙しくて会えない」でも飲み会には行く。「お金がなくてデートできない」でも趣味には使う。「疲れていて連絡できない」でもSNSは更新する。言い訳と行動が矛盾している時、行動が真実です。都合の良い言い訳に騙されないでください。行動は嘘をつきません。,False
142,女性が見極めるべきは、男性の怒りの原因です。あなたのためを思って怒るのか、自分のプライドのために怒るのか。前者は愛情、後者は支配欲です。多くの男性は「お前のため」と言いながら、実は自分の思い通りにならないことに怒っています。本当にあなたのことを考えている怒りか、よく見極めてください。,False
143,恋愛において大切なのは、相手との未来が想像できるかです。1年後、5年後、10年後。彼と一緒にいる自分が幸せそうか、それとも疲れていそうか。想像できない、または暗い未来しか見えないなら、その関係に未来はありません。直感は大切です。明るい未来が見える相手を選んでください。それが幸せへの道標です。,False
144,男性の愛情は、記念日以外の日に分かります。誕生日や記念日は誰でも頑張れます。大切なのは、何でもない日の態度です。普通の月曜日の朝、疲れた水曜日の夜、退屈な日曜日の午後。そんな時でも優しく、思いやりがあり、愛情を示してくれる。特別な日より、普通の日を大切にしてくれる人を選んでください。,False
145,恋愛で苦しむ女性の共通点は、相手を変えようとすることです。でも人を変えることはできません。できるのは、自分が変わることだけです。相手を変えようとするエネルギーを、自分を高めることに使ってください。自分が変われば、付き合う相手も変わります。内側から変化を起こすことが、外側の変化を引き寄せるのです。,False
146,別れを告げられた時、追いすがるほど相手は離れていきます。執着は愛ではなく、依存の表れです。本当の愛は、相手の幸せを願えることです。去る人を追わず、潔く手放す勇気を持ってください。その姿勢が、あなたの価値を高めます。執着を手放した時、新しい幸せがやってきます。過去より未来を選んでください。,False
147,恋愛において警戒すべきは、あなたの自信を奪う男性です。「太った？」「その服似合わない」「もっと可愛い子いる」。こういう言葉で、じわじわとあなたの自信を削いでいきます。自信を失った女性は、支配しやすくなります。これは愛ではなく、コントロールです。あなたの自信を高めてくれる人を選んでください。,False
148,女性の恋愛における盲点は、彼の元カノへの態度です。全員が「クレイジーだった」と言う男性は要注意です。共通点は元カノではなく、彼自身かもしれません。逆に、元カノを尊重し、良い思い出として語れる男性は、精神的に成熟しています。過去の関係への態度は、未来のあなたへの態度を予測させます。,False
149,恋愛で大切なのは、ケンカ後の仲直りの仕方です。きちんと話し合える、お互いの気持ちを理解しようとする、妥協点を見つける、同じケンカを繰り返さない。これができるカップルは長続きします。逆に、無視する、責め続ける、過去を蒸し返す、解決せずに流す。こういうカップルは、いずれ破綻します。,False
150,本当に愛してくれる男性は、あなたの体調を気遣います。疲れていないか聞く、無理をさせない、休息を勧める、体調不良の時は看病する。健康は何より大切です。あなたの体調を軽視する男性は、あなた自身を軽視しています。心だけでなく、体も大切にしてくれる人を選んでください。それが本物の愛です。,False
151,恋愛で見逃しがちなのは、相手の時間感覚です。いつも遅刻する、ドタキャンが多い、計画性がない。時間にルーズな人は、約束も人間関係もルーズです。あなたの時間を大切にしない人は、あなた自身も大切にしません。時間は取り戻せない貴重なものです。時間を守り、あなたの時間を尊重してくれる人を選んでください。,False
152,女性が恋愛で傷つくのは、期待と現実のギャップです。彼なら分かってくれるはず、彼なら変わってくれるはず、彼なら大切にしてくれるはず。でも「はず」は幻想です。現実を見てください。今の彼の姿が、彼の真実です。期待ではなく、現実を基準に判断することが、失望から自分を守る唯一の方法です。,False
153,恋愛において大切なのは、相手の聞く力です。あなたの話を最後まで聞く、意見を尊重する、感情を受け止める、アドバイスより共感を示す。聞く力のある男性は、良いパートナーになります。逆に、話を遮る、自分の話ばかりする、聞いているふりをする、すぐに解決策を押し付ける。こういう男性とは、深い関係は築けません。,False
154,男性の器の大きさは、謝り方で分かります。素直に非を認める、言い訳をしない、相手の気持ちを理解しようとする、同じ過ちを繰り返さない。これができる男性は信頼できます。逆に、謝らない、条件付きで謝る、相手のせいにする、形だけ謝る。こういう男性は、プライドが愛より大切なのです。,False
155,恋愛で幸せになれる女性は、自分の直感を信じます。「何か違う」「なんか嫌な感じ」「違和感がある」。この感覚を無視しないでください。理由は説明できなくても、あなたの潜在意識は危険を察知しています。論理的に考えすぎず、感覚を大切にしてください。直感は、あなたを守ろうとする心の声なのです。,False
156,別れた後、すぐに新しい恋を探す必要はありません。リバウンドで選んだ相手は、たいてい失敗します。なぜなら、傷を癒すために人を利用しているからです。まず自分と向き合い、傷を癒し、学びを得てください。準備ができた時、本当に良い出会いがやってきます。焦らず、自分のペースで進んでください。,False
157,恋愛において注意すべきは、秘密主義の男性です。スマホを見せない、予定を教えない、友人に会わせない、過去を話さない。透明性のない関係に、信頼は生まれません。もちろんプライバシーは大切ですが、パートナーに対してオープンになれない人は、何かを隠している可能性があります。透明性のある関係を築ける人を選んでください。,False
158,女性の恋愛における強みは、立ち直りの早さです。男性が過去を引きずっている間に、女性は前を向いて進んでいきます。これは弱さではなく、強さです。新しい幸せを掴む力があるということです。過去に縛られず、未来を信じる力を持ってください。あなたには、何度でも幸せになる力があるのです。,False
159,恋愛で大切なのは、笑顔の質です。あなたといる時の彼の笑顔は本物ですか。心から楽しそうですか。それとも、作り笑いですか。同じように、彼といる時のあなたの笑顔はどうですか。無理して笑っていませんか。本物の笑顔が自然に出る関係こそ、健全な関係です。偽りの笑顔で過ごす人生に、意味はありません。,False
160,本当に価値のある男性は、あなたの意見を求めます。大切な決定をする時、将来の計画を立てる時、問題を解決する時。あなたの意見を聞き、尊重し、一緒に考えてくれます。独断で物事を決める男性は、パートナーシップを理解していません。二人の人生は、二人で決めるものです。対等な関係を築ける人を選んでください。,False
161,恋愛で最も危険なのは、徐々に境界線を越えてくる男性です。最初は小さな嫌がらせ、次は少し大きな要求、最終的には完全な支配。カエルを熱湯に入れると飛び出しますが、水から徐々に温めると気づかず茹で上がります。小さな違和感を見逃さないでください。最初の境界線侵害で、きっぱりNOと言うことが大切です。,False
162,女性が恋愛で見落とすのは、彼の友人からの評価です。長年の友人が彼をどう評価しているか、友人たちはあなたとの関係を応援しているか。友人は彼の素顔を知っています。もし友人たちが警告のサインを出していたら、真剣に受け止めてください。恋愛フィルターで見えないものが、第三者には見えているのです。,False
163,恋愛において大切なのは、生活リズムの相性です。朝型か夜型か、アウトドア派かインドア派か、社交的か内向的か。最初は新鮮でも、生活リズムが合わないと疲れます。無理に相手に合わせ続けることはできません。自然体でいられる相手、リズムが合う相手を選んでください。それが長続きの秘訣です。,False
164,男性の愛情の深さは、あなたへの投資で分かります。時間、エネルギー、お金、感情。これらをどれだけあなたに投資してくれるか。口先だけの愛より、行動が伴う愛を選んでください。ただし、お金だけで判断するのは危険です。総合的な投資量を見てください。本当の愛は、全方位的な投資として現れます。,False
165,恋愛で苦しんでいる女性は、沈没コストの誤謬に陥っています。これまで費やした時間、労力、感情を無駄にしたくないから続ける。でも過去の投資は戻ってきません。大切なのは、これからの時間です。不幸な関係を続けることこそ、本当の無駄です。過去に縛られず、未来を選ぶ勇気を持ってください。,False
166,別れを決意できない理由の多くは、一人になる恐怖です。でも考えてみてください。愛のない関係にいる今も、実質一人ではありませんか。形だけの関係より、本当の一人の方が健全です。一人の時間は、自分を見つめ直し、成長し、次の幸せを準備する大切な時間です。一人を恐れず、自分と向き合ってください。,False
167,恋愛において警戒すべきは、ダブルスタンダードの男性です。自分は浮気してもいいが、彼女の浮気は許さない。自分は友達と遊んでもいいが、彼女は家にいるべき。自分の趣味は大切だが、彼女の趣味は無駄。こういう男性は、平等な関係を築けません。同じルールが適用される関係こそ、健全な関係です。,False
168,女性の恋愛における武器は、品格です。どんなに美しくても、品がなければ魅力は半減します。言葉遣い、立ち振る舞い、他人への接し方。品格は一朝一夕では身につきませんが、最も強力な魅力となります。安売りしない、自分を大切にする、他人を尊重する。品格ある女性は、品格ある男性を引き寄せます。,False
169,恋愛で大切なのは、別れ際の美しさです。もし今の関係が終わったとしても、感謝の気持ちを持って別れられるか。恨み辛みではなく、学びと成長の機会として捉えられるか。美しい別れ方ができる人は、美しい出会いに恵まれます。どんな結末でも、品位を保てる自分でいてください。それがあなたの価値を高めます。,False
170,本当に素敵な男性は、あなたの弱さを受け入れます。完璧である必要はありません。泣いてもいい、弱音を吐いてもいい、失敗してもいい。そんなあなたを丸ごと愛してくれる人がいます。強がらず、素直になってください。弱さを見せられる関係こそ、本当に強い関係です。鎧を脱いで、本当の自分を見せてください。,False
171,恋愛で失敗する女性は、赤信号を黄信号だと思い込みます。暴言は「ストレスが溜まっているだけ」、浮気は「一度きりの過ち」、嘘は「私を傷つけたくないから」。でも赤信号は赤信号です。都合の良い解釈で色を変えることはできません。危険信号を正しく認識し、自分を守る判断をしてください。あなたの安全が最優先です。,False
172,女性が気づくべきは、男性の「普通」の基準です。彼にとって女性を大切にすることは普通なのか、それとも特別な努力なのか。普通にできる人は、長期的に続けられます。努力している人は、いずれ疲れて本性を現します。あなたを大切にすることが、彼の自然な姿である人を選んでください。それが幸せの保証です。,False
